{
  "$schema": "https://json-schema.org/draft/2020-12/schema",
  "$id": "soulbah.config.schema.json",
  "title": "Configuration centrale de Soulbah (V3)",
  "description": "Fichier soulbah.config.json lu par l'agent, python-ia et node-api (shared/config/soulbah_settings.py, backend/node-api/src/lib/soulbahSettings.ts). Les variables SOULBAH_* l'emportent sur le fichier.",
  "type": "object",
  "additionalProperties": false,
  "properties": {
    "$schema": { "type": "string" },
    "description": { "type": "string" },
    "mode": {
      "description": "OFFLINE : aucune connexion externe. LOCAL_INTERNET : modèles locaux, Internet pour la recherche, la documentation, git et les téléchargements autorisés. HYBRID : local prioritaire, fournisseurs cloud configurés autorisés.",
      "enum": ["OFFLINE", "LOCAL_INTERNET", "HYBRID"]
    },
    "max_agents": { "description": "Agents en parallèle (plafond global ; SOULBAH_MAX_PARALLEL_AGENTS).", "type": "integer", "minimum": 1, "maximum": 32 },
    "resource_profile": { "description": "ECO : 2 agents au plus. BALANCED et MAX : max_agents (le Resource Manager affine selon la machine).", "enum": ["ECO", "BALANCED", "MAX"] },
    "model_policy": { "description": "auto, ou identifiant de modèle imposé (appliqué par le routeur local).", "type": "string", "pattern": "^[A-Za-z0-9_.:/-]{1,100}$" },
    "network": {
      "type": "object",
      "additionalProperties": false,
      "properties": {
        "allow_hosts": {
          "description": "Hôtes joignables même en OFFLINE (machines locales de l'utilisateur, ex. serveur de modèles du réseau local). Le bouclage est toujours permis.",
          "type": "array",
          "maxItems": 32,
          "items": { "type": "string", "pattern": "^[A-Za-z0-9.:-]{1,253}$" }
        }
      }
    },
    "computer_control": { "description": "false : souris, clavier, fenêtres, lancement d'applications et téléphone refusés par l'agent.", "type": "boolean" },
    "recording": { "description": "false : enregistrement de l'écran refusé par l'agent.", "type": "boolean" },
    "self_improvement": { "description": "Moteur d'auto-amélioration (V3 LOT 14) ; false par défaut.", "type": "boolean" }
  }
}
